S.No.,Property_Name,Price_in_INR,No_of_Bedroom,Property_type,No_of_Bathroom,Carpet_Area(Sq Ft),Garden,Property Status,Parking,Council_Tax
1715,"Hillwood Grove, Hutton Mount, Brentwood, Essex, CM13",318024699,5,Detached,3,0,Yes,-,Yes,Ask agent
1716,"Thorndon Approach, Herongate, Brentwood",304778750,5,Detached,4,5000,Yes,-,Yes,Ask agent
1717,"Ridgeway, Hutton Mount, Brentwood",296828000,4,Detached,4,0,Yes,-,Yes,Ask agent
1718,"Hay Green Lane, Hook End, CM15",286227000,6,Detached,4,0,Yes,-,Yes,Band: H
1719,"** SIGNATURE HOME ** Hay Green Lane, Hook End, Brentwood",286227000,6,Detached,5075,0,Yes,-,Yes,Band: H
1720,"Warley Road, Great Warley, CM13",286227000,4,Detached,3,0,Yes,-,Yes,Band: H
1721,"Ongar Road, Kelvedon Hatch, Brentwood",265025000,4,Detached,4,4000,Ask agent,-,Yes,Band: G
1722,"Herington Grove, Hutton Mount, Brentwood, Essex, CM13",265025000,5,Detached,4,3000,Private garden,-,Driveway,Ask agent
1723,"Sandpit Lane, Pilgrims Hatch, Brentwood, CM14",265025000,4,Detached,2,0,Yes,-,Yes,Band: G
1724,"Heronway, Hutton Mount, CM13",243823000,5,Detached,4,0,Yes,-,Yes,Band: G
1725,"Brook Road, Brentwood",84808000,4,Detached,2,0,Private garden,-,Off street,Band: F
1726,"Weald Park Way, South Weald, Brentwood, CM14 5QH",238522500,5,Detached,7,6000,Yes,-,Yes,Band: F
1727,"Coombe Rise, Shenfield, Brentwood, Essex, CM15",238522500,5,Detached,4,0,Yes,-,Yes,Ask agent
1728,"Glanthams Close, Shenfield, CM15",238522500,5,Detached,4,3000,Yes,-,Yes,Band: G
1729,"Weald Park Way, South Weald",238522500,5,Detached,4,0,Yes,-,Yes,Ask agent
1730,"Ongar Road, Kelvedon Hatch, Brentwood, CM15 0LA",238522500,7,Detached,3,5000,Yes,-,On street,Band: H
1731,"Frog Street, Kelvedon Hatch, Brentwood",235872250,4,Detached,4,0,Yes,-,Ask agent,Band: H
1732,"Heronway, Hutton Mount, Brentwood",233222000,5,Detached,5,3000,Yes,-,Yes,Ask agent
1733,"Mill Hill, Shenfield, Brentwood",227921500,4,Detached,3,0,Yes,-,Yes,Ask agent
1734,"Park Avenue, Hutton, Brentwood",212020000,7,Detached,6,0,Yes,-,Yes,Ask agent
1736,"Beredens Lane, Brentwood, Essex",212020000,6,Detached,8,4000,Private garden,-,"Garage,",Band: G
1737,"Park Avenue, Hutton, CM13",212020000,6,Detached,5,0,Yes,-,Yes,Band: G
1738,"Worrin Road, Shenfield, Brentwood",212019893,5,Detached,4,0,Yes,-,Yes,Ask agent
1739,"Ashwells Road, Pilgrims Hatch, Brentwood",206719500,7,Barn Conversion,7,0,Ask agent,-,Yes,Ask agent
1740,"Ashwells Road, Pilgrims Hatch, Brentwood, CM15 9SE",206719500,7,Barn Conversion,7,4000,Yes,-,Yes,Band: H
1741,"Ashwells Road, Pilgrims Hatch",206719500,7,Detached,3,4000,Yes,-,Yes,Band: H
1742,"Spurgate, Hutton, Brentwood, CM13",201419000,4,Detached,4,0,Yes,-,Yes,Ask agent
1743,"Wambrook Close, Hutton, Brentwood, CM13",198768750,5,Detached,3,0,Yes,-,Yes,Ask agent
1744,"Priests Lane, Shenfield, Brentwood",190818000,5,Detached,4,3000,Yes,-,Yes,Band: G
1746,"Hartswood Road, Warley",185517500,4,Detached,3,2000,Ask agent,-,Yes,Band: H
1747,"Mount Avenue, Hutton Mount, CM13",185517500,5,Detached,2,0,Yes,-,Yes,Band: H
1748,"Chivers Road, Stondon Massey, CM15",185517500,5,Bungalow,3,0,Yes,-,Yes,Band: F
1749,"Shenfield Road, Shenfield, Brentwood, CM15",185517500,4,Detached,3,0,Yes,-,Yes,Ask agent
1750,"Willow Close, Nr Hutton Mount, Brentwood, Essex, CM13",137813000,3,Detached,3,1000,Private garden,-,Driveway,Ask agent
1751,"Warley Hill, Brentwood",185517500,5,Detached,2,0,Yes,-,Yes,Ask agent
1752,"Baymans Wood, Old Shenfield, CM15",179686950,5,Detached,3,2000,Yes,-,Yes,Band: G
1753,"Ridgeway, Hutton, Brentwood, CM13",179686950,5,Detached,3,0,Yes,-,Yes,Ask agent
1754,"** SIGNATURE HOME ** Blackmore Road, Hook End",174916500,7,Detached,5,5000,Yes,-,Yes,Band: G
1755,"Roundwood Grove, Hutton Mount, Brentwood",174916500,5,Detached,3,0,Yes,-,Yes,Ask agent
1756,"Hillwood Close, Hutton Mount, Brentwood",174916500,5,Detached,3,0,Yes,-,Yes,Ask agent
1758,"Hillwood Grove, Hutton Mount, Brentwood",169616000,5,Detached,2,0,Yes,-,Yes,Ask agent
1759,"Hutton Gate, Hutton Mount, Brentwood",169616000,4,Detached,2,0,Yes,-,Yes,Ask agent
1760,"The Chase, Seven Arches Road, CM14",164315500,5,Detached,3,2000,Yes,-,Yes,Band: H
1761,"Doddinghurst Road, Pilgrims Hatch, CM15",159015000,4,Detached,3,0,Yes,-,Yes,Band: G
1762,"Doddinghurst Road, Pilgrims Hatch, CM15",159015000,4,Detached,3,0,Yes,-,Yes,Band: G
1763,"Mores Lane, Pilgrims Hatch, Brentwood",159015000,4,Detached Bungalow,3,0,Yes,-,Yes,Band: G
1764,"Blackmore Road, Brentwood, CM15",159015000,4,Detached,3,0,Yes,-,Yes,Band: G
1765,"Weston Close, Hutton Burses, Brentwood",159015000,6,Detached,5,0,Yes,-,Yes,Band: F
1766,"Hatch Road, Brentwood",159015000,4,Detached,1,0,Yes,-,Yes,Ask agent
1768,"London Road, Brentwood",159015000,5,Detached,4,0,Yes,-,Yes,Ask agent
1769,"** SIGNATURE HOME ** Cory Drive, Hutton, Brentwood",158484950,4,Detached,2,0,Yes,-,Yes,Band: G
1770,"** SIGNATURE HOME ** Navestock Side, Brentwood",153714500,4,Detached,3,3000,Yes,-,Yes,Band: G
1771,"Park Avenue, Hutton, Brentwood, CM13",153714500,5,Detached,3,0,Yes,-,Yes,Ask agent
1772,"Doddinghurst Road, Doddinghurst, Brentwood",148414000,8,House,5,0,Yes,-,Yes,Ask agent
1773,"Dark Lane, Great Warley, Brentwood, Essex, CM14",148414000,4,Detached,2,0,Yes,-,Yes,Band: TBC
1774,"Crescent Drive, Shenfield, CM15",148414000,4,Detached,3,2000,Yes,-,Yes,Band: G
1775,"Broomwood Gardens, Pilgrims Hatch, BRENTWOOD",51944900,3,Semi-Detached,3,0,"Back garden,",-,Off street,Band: D
1776,"Shenfield Place, Shenfield, CM15",148414000,4,Detached,2,0,Yes,-,Yes,Band: G
1777,"Sandpit Cottage, Brentwood",148414000,4,Detached,3,3000,Private garden,-,Off street,Ask agent
1779,"Chelmsford Road, Shenfield, Brentwood, CM15",148414000,4,Detached,2,0,Yes,-,Yes,Ask agent
1781,"Nags Head Lane, Brentwood, Essex, CM14",143113500,5,Detached,3,0,Yes,-,Yes,Band: G
1782,"Spurgate, Hutton Mount, CM13",143113500,4,Detached,4,2000,Yes,-,Yes,Band: TBC
1783,"Roman Road, Mountnessing, Brentwood",143113500,6,Detached,3,0,Yes,-,Yes,Band: G
1784,"Spurgate, Hutton, Brentwood, Essex, CM13",143113500,4,Detached,4,3000,Private garden,-,Driveway,Ask agent
1785,"Spurgate, Hutton, Brentwood",143113500,4,Detached,4,0,Yes,-,Ask agent,Ask agent
1786,"Newmans Drive, Hutton, CM13",140463250,3,Bungalow,2,1000,Yes,-,Yes,Band: F
1787,"Worrin Road, Shenfield, Brentwood, CM15",137813000,4,Detached,2,0,Yes,-,Yes,Ask agent
1788,"Headley Chase, Warley, CM14",137813000,4,Detached,3,2000,Yes,-,Yes,Band: G
1789,"Rochford Avenue, Shenfield, Brentwood, CM15",137813000,4,Detached,2,0,Yes,-,Yes,Ask agent
1790,"Willow Close, Nr Hutton Mount, Brentwood, Essex, CM13",137813000,3,Detached,3,1000,Private garden,-,Driveway,Ask agent
1791,"Headley Chase, Brentwood",137813000,4,Detached,4,2000,Private garden,-,Off street,Ask agent
1792,"Hall Lane, Shenfield, Brentwood",137282950,6,Detached,2,0,Yes,-,Yes,Ask agent
1793,"Friars Avenue, Shenfield, Brentwood",135162750,4,Detached,3,0,Yes,-,Yes,Ask agent
1794,"Boyles Court, Dark Lane, Great Warley, Brentwood, CM14",135162750,5,Terraced,4,2000,Ask agent,-,Yes,Band: G
1795,"Headley Chase, Brentwood, Essex, CM14",135162750,5,Detached,3,0,Yes,-,Yes,Ask agent
1796,"Hanover Place, Warley, CM14",132512500,5,Detached,3,0,Yes,-,Yes,Band: H
1797,"Brook Road, Brentwood, CM14",132512500,4,Detached,3,0,Yes,-,Yes,Band: F
1798,"Chelmsford Road, Shenfield Brentwood, Essex, CM15",132512500,4,Detached,2,0,Yes,-,Yes,Ask agent
1799,"Shenfield Gardens, Hutton, Brentwood, CM13",132512500,4,Detached,3,0,Yes,-,Yes,Ask agent
1800,"Orchard Lane, Pilgrims Hatch, Brentwood",65196150,4,Detached Bungalow,2,0,Yes,-,Yes,Band: D
1801,"** SIGNATURE HOME ** Great Warley Street, Great Warley, Brentwood",132512500,4,Detached,2,0,Yes,-,Yes,Band: G
1802,"Brook Lane, Doddinghurst, Brentwood, Essex, CM15",132512500,4,Detached,3,0,Yes,-,Yes,Band: G
1803,"King William IV, Tan House Lane",132512500,4,Detached,3,2000,Yes,-,Yes,Band: G
1804,"** SIGNATURE HOME ** Hook End Road, Hook End",132512500,4,Detached,3,2000,Yes,-,Yes,Band: G
1805,"Oakwood Avenue, Hutton, CM13",132512500,4,Detached,3,0,Yes,-,Yes,Band: G
1806,"Coxtie Green Road, Brentwood",132512500,5,Detached,3,4000,Private garden,-,Off street,Ask agent
1807,"Great Warley Street, Great Warley, CM13",132512500,4,Detached,2,0,Yes,-,Yes,Band: G
1808,"Chelmsford Road, Shenfield",132512500,4,Detached,4,2000,Yes,-,Yes,Band: G
1809,"Warley HQ, Eagle way, Great Warley, Brentwood, CM13 3BW",132512500,3,Penthouse,3,1000,Terrace,"TENURE
Leasehold","Secure,",Ask developer
1810,"Glanthams Road, Shenfield, Brentwood, CM15",129862250,4,Detached,2,0,Yes,-,Yes,Ask agent
1811,"Nags Head Lane, Brentwood",127212000,4,Detached,3,0,Yes,-,Yes,Band: F
1812,"Brentwood Road, Herongate, Brentwood",127212000,5,Detached,2,3000,On street,-,-,Band: G
1813,"Mount Crescent, Warley, Brentwood",127212000,6,Detached,3,2000,Yes,-,Yes,Ask agent
1814,"Brentwood Road, Herongate, CM13",127212000,5,Detached,2,0,Yes,-,Yes,Band: G
1815,"London Road, Brentwood, CM14",127212000,4,Detached,3,1000,Yes,-,Yes,Band: G
1816,"London Road, Brentwood, CM14",127212000,5,Detached,4,0,Yes,-,Off street,Ask agent
1817,"Eleanor Way, Warley, Brentwood, Essex",126681950,4,Detached,3,2000,Yes,-,Yes,Band: TBC
1818,"Park Avenue, Hutton, Brentwood, Essex, CM13",126681950,5,Detached,3,0,Yes,-,Yes,Ask agent
1819,"Wansford Close, Brentwood",126681950,5,Detached,3,2000,Yes,-,Yes,Band: F
1820,"High Street, Brentwood, Essex, CM14",124561750,4,Terraced,2,0,Yes,-,Yes,Band: F
1821,"Sebastian Avenue, Shenfield, Brentwood, Essex, CM15",124561750,3,Detached,2,0,Enclosed garden,-,Driveway,Ask agent
1822,"Hatch Road, Brentwood",121911500,5,Detached,3,2000,Private garden,-,Off street,Ask agent
1823,"Magpie Lane, Little Warley, Brentwood, CM13",121911500,3,Detached,2,0,Ask agent,-,Yes,Band: F
1824,"Hanging Hill Lane, Hutton, CM13",116611000,4,Detached,2,1000,Yes,-,Yes,Band: G
1825,Welcome to Candleford Mews - Brentwood,95409000,4,Detached,2,1000,"Back garden,",-,"No disabled parking,",Ask agent
1826,"The Avenue, Thorndon Park, CM13",116611000,4,Detached,2,0,Yes,-,Yes,Band: F
1827,"Doddinghurst Road, Pilgrims Hatch, Brentwood",116611000,4,Detached,2,0,Yes,-,Yes,Band: G
1828,Welcome to Candleford Mews - Brentwood,116611000,5,Semi-Detached,3,1000,"Back garden,",-,"On street,",Ask agent
1829,"Nags Head Lane, Brentwood, Essex, CM14",116611000,4,Detached,3,0,Yes,-,Yes,Band: F
1830,"Cornsland, Brentwood, CM14",116611000,4,Semi-Detached,4,2000,Yes,-,Ask agent,Band: G
1831,"Headley Chase, Warley, CM14",116611000,4,Detached,2,1000,Yes,-,Yes,Band: G
1832,"Dark Lane, Great Warley, Brentwood, Essex, CM14",116611000,4,Mews,3,0,Yes,-,Yes,Band: TBC
1833,"Selwood Road, Brentwood, CM14",111310500,4,Detached,1,1000,Yes,-,Yes,Band: G
1834,"Hanging Hill Lane, Hutton, Brentwood, Essex, CM13",111310500,4,Detached,2,0,Yes,-,Driveway,Ask agent
1835,"Tennyson Road, Hutton, Brentwood, Essex, CM13",111310500,4,Detached,2,0,Yes,-,Yes,Ask agent
1836,"Nags Head Lane, Brentwood",106010000,4,Detached Bungalow,3,2000,Private garden,-,Off street,Band: E
1837,"Priests Lane, Shenfield, Brentwood, CM15",106010000,3,Semi-Detached,1,0,Yes,-,Yes,Ask agent
1838,"Outings Lane, Doddinghurst",106010000,5,Detached,3,0,Yes,-,Yes,Ask agent
1839,"Poplar Drive, Hutton, CM13",106010000,5,Detached,3,0,Yes,-,Yes,Band: G
1840,"London Road, Brentwood",106010000,4,Semi-Detached,2,0,Yes,-,Yes,Ask agent
1841,"Watlington Gardens, Great Warley, CM13",106010000,4,Detached,2,1000,Yes,-,Yes,Band: G
1842,"Alexander Lane, Hutton, CM13",106010000,4,Semi-Detached,2,0,Yes,-,Yes,Band: E
1843,"Doddinghurst Road, Pilgrims Hatch, Brentwood, Essex, CM15",106010000,5,Bungalow,3,0,Yes,-,Yes,Band: F
1844,"Cricketers Lane, Herongate, Brentwood",106010000,3,Detached,2,1000,Yes,-,Yes,Ask agent
1845,"Outings Lane, Doddinghurst, Brentwood",106010000,5,Detached,2,2000,Yes,-,Yes,Band: G
1846,"Eleanor Way, Warley, CM14",106010000,3,Detached,1,0,Yes,-,Yes,Band: F
1847,"Hook End Road, Hook End, CM15",106010000,4,Detached,4,0,Yes,-,Yes,Band: F
1848,"Hook End Road, Hook End, Brentwood, Essex, CM15",106010000,4,Detached,4,0,Yes,-,Yes,Band: TBC
1849,"St. Nicholas Grove, Ingrave, Brentwood, Essex, CM13",106010000,5,Detached,2,2000,Yes,-,Yes,Band: G
1850,"Westwood Avenue, Brentwood",66256250,3,Semi-Detached,1,1000,Yes,-,Yes,Band: E
1851,"Rayleigh Road, Hutton, CM13",106010000,5,Detached,3,2000,Yes,-,Yes,Band: G
1852,"Pine Court, Great Warley, Brentwood, Essex, CM13",106010000,3,Detached,3,0,Yes,-,Yes,Band: TBC
1853,"Days Lane, Pilgrims Hatch, Brentwood, Essex, CM15",106010000,3,Detached,2,0,Yes,-,Yes,Band: E
1854,"Roman Road, Shenfield",106010000,4,Detached,3,0,Yes,-,Yes,Ask agent
1855,"Riseway, Brentwood, Essex",105479950,4,Detached,3,0,Yes,-,Yes,Ask agent
1857,"Boyles Court, Dark Lane, Great Warley, Brentwood, CM14",105479950,4,Terraced,4,1000,Ask agent,-,Yes,Band: E
1858,"School Road, Kelvedon Hatch, Brentwood, Essex, CM15",105479950,4,Detached,2,0,Private garden,-,Driveway,Ask agent
1860,"Poplar Drive, Hutton, Brentwood, Essex, CM13",103359750,5,Detached,3,0,Yes,-,Yes,Ask agent
1861,"Holmwood Avenue, Shenfield, Brentwood",103359750,4,Detached,2,1000,Yes,-,Ask agent,Band: F
1862,"Mulberry Hill, Shenfield, Brentwood",103359750,4,Detached,2,0,Yes,-,Yes,Ask agent
1863,"Spurgate, Hutton, CM13",100709500,4,Detached,2,0,Yes,-,Yes,Band: G
1864,"Coxtie Green Road, Pilgrims Hatch",100709500,4,Semi-Detached,2,1000,Yes,-,Yes,Band: E
1865,"Doddinghurst Road, Brentwood, Essex, CM15",100709500,5,Detached,2,0,Yes,-,Yes,Band: F
1866,"Common Road, Ingrave, Brentwood, Essex, CM13",100709500,5,Detached,3,0,Yes,-,Yes,Band: F
1867,"Coxtie Green Road, Pilgrims Hatch, Brentwood",100709500,4,Character Property,2,0,"Back garden,",-,Yes,Band: E
1868,"Dealtree Close, Hook End, Brentwood",100709500,5,Detached Bungalow,3,2000,Yes,-,Yes,Band: F
1869,"Ingrave Road, Brentwood",100709500,3,Detached,2,1000,Private garden,-,"Garage,",Band: F
1870,"Lewis Close, Shenfield, Brentwood",100709500,3,Detached Bungalow,2,0,"Back garden,",-,Off street,Band: F
1871,"Santhem Residences, Shenfield",100709500,2,Retirement Property,2,1000,Private garden,"TENURE
Leasehold",Yes,Band: G
1872,"The Sheas, 41 Shenfield Road",100179450,3,Apartment,2,1000,Yes,"TENURE
Leasehold",Yes,Ask agent
1873,"Shenfield Road, Shenfield, Brentwood",100179450,3,Apartment,2,1000,Yes,"TENURE
Leasehold",Yes,Band: G
1874,"Shenfield Road, Shenfield, Brentwood",100179450,2,Apartment,3,1000,Ask agent,"TENURE
Leasehold",Yes,Band: F
1875,"Orchard Lane, Pilgrims Hatch, Brentwood",65196150,4,Detached Bungalow,2,0,Yes,-,Yes,Band: D
1876,"Hall Green Lane, Brentwood, CM13",98059250,5,Detached,3,1000,Yes,-,"Garage,",Band: E
1877,"Hall Green Lane, Brentwood, CM13",98059250,5,Detached,3,0,Yes,-,Yes,Band: G
1878,"Shenfield Road, Shenfield, Brentwood",98059250,2,Apartment,2,1000,Ask agent,"TENURE
Leasehold",Yes,Band: F
1879,"41 Shenfield Road, Shenfield, Brentwood",98059250,2,Apartment,2,1000,Yes,"TENURE
Leasehold",Allocated,Ask agent
1880,"Belvedere Road, Brentwood",95409000,5,Detached,2,1000,Private garden,-,Off street,Ask agent
1881,"Sycamore and Geary Drive, Brentwood",95409000,10,House,4,0,Yes,-,Yes,Ask agent
1882,Welcome to Candleford Mews - Brentwood,95409000,4,Detached,2,1000,"Back garden,",-,"On street,",Ask agent
1883,"Worrin Road, Shenfield, CM15",95409000,3,Detached,1,0,Yes,-,Yes,Band: G
1884,"Lyndhurst Way, Hutton, Brentwood",95409000,4,Detached,2,1000,Yes,-,Yes,Ask agent
1885,"Spring Pond Meadow, Brentwood",95409000,4,Detached,2,1000,Yes,-,Yes,Band: G
1886,"Nags Head Lane, Brentwood, Essex, CM14",95409000,4,Detached,2,0,Yes,-,Yes,Band: TBC
1887,"Stocks Lane, Kelvedon Hatch, Brentwood",95409000,4,Detached,2,2000,Yes,-,Yes,Band: F
1888,"Boyles Court, Dark Lane, Great Warley, Brentwood, CM14",95409000,2,Flat,2,1000,Ask agent,"TENURE
Leasehold",Ask agent,Band: G
1889,"Priests Lane, Shenfield, Brentwood",95409000,4,Semi-Detached,2,0,Yes,-,Yes,Band: F
1890,"Little Warley Hall Lane, Little Warley, CM13",95409000,4,Detached,2,0,Yes,-,Yes,Band: F
1891,"Rhapsody Crescent, Warley, Brentwood",95409000,4,Terraced,3,2000,Yes,-,Yes,Band: G
1892,"Horseman Side, Brentwood, Essex, CM14",95409000,3,Detached,2,0,Yes,-,Yes,Ask agent
1893,"Chelmsford Road, Shenfield, CM15",95409000,4,Semi-Detached,3,1000,Yes,-,Yes,Band: F
1894,"Doddinghurst Road, Doddinghurst, Brentwood, Essex, CM15",95409000,4,Detached,4,0,Yes,-,Yes,Band: G
1895,"Nags Mews, Nags Head Lane, Brentwood",95409000,4,Detached,3,0,Yes,-,Yes,Band: TBC
1896,"Nags Mews, Nags Head Lane, Brentwood",95409000,4,Detached,3,0,Yes,-,Yes,Band: TBC
1897,"Crossways, Shenfield, Brentwood, Essex, CM15",95409000,4,Detached,1,2000,Yes,-,Yes,Band: G
1898,"Hook End, Brentwood, Essex CM15",95409000,4,Detached,5,0,Yes,-,Yes,Ask agent
1899,"Cory Drive, Hutton, CM13",94878950,3,Bungalow,1,0,Yes,-,Yes,Band: F
1900,"Clarence Road, Pilgrims Hatch, Brentwood",42404000,2,Terraced,1,0,Yes,-,Yes,Band: C
1901,"Navestockside, Brentwood",94878950,3,Detached,1,0,Yes,-,Yes,Ask agent
1902,"Langley Drive, Brentwood, CM14",94348900,4,Bungalow,2,0,Yes,-,Yes,Band: E
1903,"Shorter Avenue, Shenfield, Brentwood",92758750,4,Detached Bungalow,4,0,Yes,-,Yes,Band: G
1904,"Dark Lane, Great Warley, Brentwood, Essex, CM14",92758750,4,Terraced,3,0,Yes,-,Yes,Band: E
1905,"Regent Way, Brentwood",92758750,4,Terraced,4,0,Yes,-,Yes,Ask agent
1906,"Hall Lane, Shenfield, Brentwood, CM15",92758750,4,Detached,1,0,Yes,-,Yes,Ask agent
1907,"Boyles Court, Dark Lane, Great Warley, Brentwood, CM14",92758750,3,Terraced,3,1000,Ask agent,-,Yes,Band: E
1908,"Rayleigh Road, Hutton, Brentwood",92758750,3,Detached,3,0,Yes,-,Yes,Band: G
1909,"Shenfield Road, Shenfield, Brentwood",92758750,2,Apartment,2,1000,Ask agent,"TENURE
Leasehold",Yes,Band: E
1910,"Warley Hill, Warley, Brentwood",90108500,5,Detached,2,0,Yes,-,Yes,Band: E
1911,"Hillside Walk, Brentwood, CM14",90108500,4,Semi-Detached,2,0,Yes,-,Yes,Band: F
1912,"Dunton Road, Billericay",90108500,4,Semi-Detached,2,0,Yes,-,Yes,Band: F
1913,"Pittman Close, Ingrave, CM13",90108500,4,Detached,2,0,Yes,-,Yes,Band: F
1914,"Kensington Road, Pilgrims Hatch, Brentwood, Essex, CM15",90108500,4,Detached,3,0,Yes,-,Yes,Ask agent
1915,"First Avenue, Hook End.",90108500,3,Detached,2,0,Yes,-,Yes,Band: G
1917,"Nags Head Lane, Brentwood, CM14",90108500,4,Detached,2,0,Yes,-,Yes,Band: E
1918,"Hutton Road, Shenfield, CM15",90108500,4,Semi-Detached,1,1000,Yes,-,Yes,Band: E
1919,"Chelmsford Road, Shenfield, CM15",90108500,4,Detached,2,0,Yes,-,Yes,Band: G
1920,"Mulberry Hill, Shenfield, Brentwood",90108500,4,Detached,1,0,Yes,-,Yes,Band: G
1921,"Friars Avenue, Shenfield, Essex, CM15",88518350,4,Semi-Detached,2,0,Yes,-,Yes,Ask agent
1923,"Hunter Avenue, Shenfield, Brentwood",87458250,4,Detached,2,2000,Yes,-,Yes,Ask agent
1924,"Watlington Gardens, Brentwood",87458250,4,Detached,3,0,Ask agent,-,Yes,Ask agent
1925,Welcome to Candleford Mews - Brentwood,95409000,4,Detached,2,1000,"Back garden,",-,"On street,",Ask agent
1926,"King Georges Road, Pilgrims Hatch, CM15",87458250,4,Detached,2,1000,Yes,-,Yes,Band: F
1927,"Nine Ashes Road, Stondon Massey, Brentwood",87458250,4,Detached,3,1000,Yes,-,Yes,Band: G
1928,"Shenfield Road, Shenfield, Brentwood",87458250,2,Apartment,2,1000,Ask agent,"TENURE
Leasehold",Yes,Band: E
1929,"Magnolia Crescent, Great Warley, CM13",87458250,4,End of Terrace,2,1000,Yes,-,Yes,Band: G
1930,"41 Shenfield Road, Shenfield, Brentwood",87458250,2,Penthouse,2,1000,Ask agent,"TENURE
Leasehold",Allocated,Ask agent
1931,"Chelsea Way, Brentwood, CM14",87458250,3,Semi-Detached,2,0,Yes,-,Yes,Band: E
1932,"Ongar Road, Stondon Massey",87458250,5,Semi-Detached,3,1000,Yes,-,Yes,Band: F
1934,"Hanging Hill Lane, Hutton, CM13",84808000,4,Semi-Detached,4,2000,Yes,-,Yes,Band: D
1935,"Spring Pond Meadow, Hook End, Brentwood, Essex, CM15",84808000,4,Detached,2,0,Yes,-,Yes,Band: TBC
1936,"Mount Crescent, Warley, CM14",84808000,4,Detached,2,1000,Yes,-,Yes,Band: F
1937,"The Chase, Ingrave, CM13",84808000,5,Detached,2,0,Yes,-,Yes,Band: F
1938,"Little Warley Hall Lane, Brentwood, CM13",84808000,3,Bungalow,2,0,Yes,-,Yes,Ask agent
1939,"Greenway, Romford",84808000,4,Detached,2,0,Yes,-,Yes,Ask agent
1940,"Collins Way, Hutton, Brentwood",84808000,4,Detached,3,0,Yes,-,Yes,Ask agent
1941,"Brook Road, Brentwood",84808000,4,Detached,2,0,Private garden,-,Off street,Band: F
1942,Welcome to Candleford Mews - Brentwood,84808000,3,Detached,2,1000,"Back garden,",-,"No disabled parking,",Ask agent
1943,"King Georges Road, Pilgrims Hatch, Brentwood",84808000,4,Detached,3,0,Yes,-,Yes,Ask agent
1944,"Chivers Road, Brentwood, CM15",84808000,3,Detached,2,0,Yes,-,Yes,Ask agent
1945,"Boyles Court, Dark Lane, Great Warley, Brentwood, CM14",84808000,3,Terraced,2,1000,Ask agent,-,Yes,Band: F
1946,"Thorndon Avenue, West Horndon, Brentwood, Essex, CM13",84808000,5,Detached,3,0,Yes,-,Yes,Band: G
1947,"Little Warley Hall Lane, BRENTWOOD, Essex, CM13",84808000,3,Bungalow,1,0,Yes,-,Yes,Band: TBC
1948,"Coxtie Green Road, Brentwood, CM14",84808000,2,Cottage,2,0,Yes,-,Yes,Ask agent
1949,"Ongar Road, Brentwood",84808000,5,Semi-Detached,3,0,Yes,-,Yes,Ask agent
1950,"Tiger Moth Way, Salisbury Village",47704500,4,Town House,2,0,Yes,-,Yes,Band: E
1951,"Ellenbrook Lane, Hatfield, Hertfordshire",159015000,5,Detached,5,0,Yes,-,Yes,Band: G
1952,The Laurels,137388429,4,Detached,3,3000,Private garden,-,Garage,Ask agent
1953,"Wild Hill, Essendon, Hertfordshire",106010000,4,Detached,2,0,Yes,-,Yes,Band: F
1954,"The Ryde, Hatfield",106010000,4,Detached,2,1000,Yes,-,Yes,Band: F
1955,"Pleasant Rise, Hatfield",95409000,5,Detached,2,1000,Yes,"TENURE
Leasehold",Yes,Band: G
1956,Essendon,95409000,4,Mews,2,0,Yes,-,Yes,Band: G
1957,"Brookside, Ellenbrook, AL10 9RR",95409000,4,Detached,2,0,Yes,-,"Garage,",Band: F
1958,"Bluebell Way, Hatfield, AL10",92758750,5,Detached,3,0,Yes,-,Yes,Ask agent
1959,"St Albans Road West, Hatfield, AL10",85868100,4,Semi-Detached,4,0,Yes,-,Yes,Ask agent
1960,"Minster Close, Hatfield, AL10",84808000,4,Detached,2,0,Yes,-,Yes,Band: F
1961,"Endymion Road, Hatfield, Hertfordshire, AL10",80037550,4,Semi-Detached,2,1000,Yes,-,Yes,Band: F
1962,"Bramble Road, Hatfield",79507500,4,Semi-Detached,1,0,Yes,-,Yes,Band: E
1963,"Ivy Walk, Hatfield, Hertfordshire, AL10",79507500,4,Detached,2,1000,Enclosed garden,-,Garage,Band: E
1964,"The Ryde, Hatfield, AL9",79507500,3,Detached Bungalow,1,0,Ask agent,-,Yes,Band: F
1965,"Dragon Road, Hatfield",76857250,5,Detached,3,0,Back garden,-,Off street,Band: G
1966,"Lavender Close, Hatfield, Hertfordshire",76857250,4,Detached,2,0,Yes,-,Yes,Band: F
1967,"Bishops Close, Hatfield",74207000,5,Detached,3,1000,Yes,-,Off street,Band: F
1968,"Bramble Road, Hatfield",74207000,4,Semi-Detached,2,0,Yes,-,Ask agent,Band: E
1969,"Selwyn Crescent, Hatfield",74207000,4,Semi-Detached,2,0,Back garden,-,Off street,Band: E
1970,"Horsa Gardens, Hatfield",74207000,5,Detached,3,2000,Yes,-,Yes,Band: G
1971,"Endymion Road, Hatfield",73676950,3,Detached,1,969000,Yes,-,Yes,Band: F
1972,"Endymion Road, Hatfield",73676950,3,Character Property,2,0,Yes,-,Yes,Ask agent
1973,"Brookside, Hatfield, AL10",71556750,4,Detached,1,0,Yes,-,Yes,Band: F
1974,"The Runway, Salisbury Village, Hatfield",71556750,5,Detached,4,0,Yes,-,Yes,Band: G
1975,"Cheviots, Hatfield",37103500,4,Terraced,1,0,Back garden,-,On street,Band: C
1976,"Brookside, Hatfield, AL10",71556750,4,Detached,1,1000,"Rear garden,",-,"Garage,",Band: F
1977,"The Runway, Hatfield",71556750,5,Detached,3,0,Yes,-,Yes,Band: G
1978,"Hollyfield Place, Hatfield, Hertfordshire",69966600,4,Detached,2,1000,Yes,-,Yes,Band: TBC
1979,"Daffodil Close, Hatfield, Hertfordshire",68906500,4,Detached,2,0,Yes,-,Yes,Band: E
1980,"Sycamore Avenue, Hatfield, Herts, AL10",68906500,3,Detached,1,0,Private garden,-,Driveway,Ask agent
1981,"The Ryde, Hatfield, AL9",68906500,3,Detached Bungalow,1,1000,"Rear garden,",-,"Garage,",Band: F
1982,"Fore Street, Hatfield, AL9",68906500,3,Cottage,1,0,Yes,-,Ask agent,Band: F
1983,"Selwyn Crescent, Hatfield",68906500,3,Semi-Detached,1,0,Yes,-,Yes,Band: E
1985,"Selwyn Drive, HATFIELD, AL10",66256250,3,Semi-Detached,1,0,Yes,-,Yes,Ask agent
1986,"Bramble Road, Hatfield, Hertfordshire, AL10",66256250,3,Semi-Detached,1,807000,Yes,-,Yes,Band: E
1987,"Briars Lane, Hatfield",63606000,3,Bungalow,1,1000,Private garden,"TENURE
Leasehold",Off street,Band: E
1988,"Wellands, Hatfield, AL10",63606000,3,Detached Bungalow,1,1000,Private garden,-,Driveway,Band: E
1989,"Sparrowhawk Place, Hatfield",60955750,4,Town House,2,1000,Yes,-,Yes,Band: E
1990,"Cecil Crescent, Hatfield, AL10",60955750,4,Semi-Detached,2,0,Yes,-,Yes,Band: D
1991,"Gorseway, Hatfield, Hertfordshire, AL10",60955750,3,Semi-Detached,1,954000,Yes,-,Yes,Band: D
1992,"Hollyfield Place, Hatfield, Hertfordshire",60425700,3,Detached,2,1000,Yes,-,Yes,Band: TBC
1993,"Hollyfield Place, Hatfield, Hertfordshire",59365600,3,Detached,2,1000,Yes,-,Yes,Band: TBC
1994,"Roe Green Lane, Hatfield, Herts, AL10",58305500,3,Detached,1,0,Yes,-,Yes,Ask agent
1995,"Heathcote Avenue, Hatfield",58305500,4,Semi-Detached,2,990000,Yes,-,Yes,Band: D
1996,"Gorseway, Hatfield, Hertfordshire, AL10",58305500,3,End of Terrace,1,786000,Yes,-,Yes,Band: D
1997,"Broad Acres, Hatfield",57775450,5,End of Terrace,2,1000,Private garden,-,Off street,Band: C
1998,"Plot 43 Hatfield East, Old Rectory Drive, Hatfield, AL10",57245400,3,End of Terrace,2,1000,Yes,-,Yes,Ask agent
1999,"Plot 66 Hatfield East Houses, Old Rectory Drive, Hatfield, AL10",56715350,3,Terraced,2,1000,Private garden,-,Yes,Ask agent
2000,"Plot 43 Hatfield East, Old Rectory Drive, Hatfield, AL10",57245400,3,End of Terrace,2,1000,Yes,-,Yes,Ask agent
2001,"Crawford Road, Hatfield",56185300,4,Semi-Detached,1,1000,Yes,-,Yes,Band: D
2002,"Roe Green Lane, Hatfield",56079290,3,Semi-Detached,1,0,Yes,-,Yes,Band: D
2003,"Batterdale, Hatfield, AL9",55655250,4,Town House,2,0,Ask agent,-,Yes,Band: E
